[
  {
    "id": "ex-figures-001",
    "module": "figures-de-style",
    "title": "Repérer les procédés dans « L'Albatros »",
    "difficulty": 2,
    "estimatedMinutes": 12,
    "order": 10,
    "tags": ["repérage", "poésie"],
    "preamble": "Lis attentivement la première strophe du poème, puis réponds aux questions de repérage.",
    "extract": "Souvent, pour s'amuser, les hommes d'équipage\nPrennent des albatros, vastes oiseaux des mers,\nQui suivent, indolents compagnons de voyage,\nLe navire glissant sur les gouffres amers.",
    "extractSource": "Charles Baudelaire, « L'Albatros », Les Fleurs du mal, 1861",
    "questions": [
      {
        "id": "q1",
        "label": "1.",
        "statement": "Relève l'expression qui désigne la mer dans le dernier vers et nomme la figure de style employée.",
        "hints": [
          "Cherche une expression imagée, sans outil de comparaison.",
          "« gouffres » suggère un abîme : la mer est désignée par une image."
        ],
        "expectedAnswer": "« les gouffres amers » : une métaphore désignant la mer.",
        "solution": "L'expression **« les gouffres amers »** désigne la mer. Il s'agit d'une **métaphore** : la mer (comparé) est assimilée à des gouffres (comparant), sans outil de comparaison. L'adjectif « amers » rappelle à la fois le goût salé de l'eau et une connotation négative (l'amertume), ce qui annonce la chute de l'oiseau dans la suite du poème."
      },
      {
        "id": "q2",
        "label": "2.",
        "statement": "Comment les albatros sont-ils caractérisés au vers 3 ? Quel effet cette caractérisation produit-elle ?",
        "hints": [
          "Observe l'expression « indolents compagnons de voyage ».",
          "Pense au contraste entre la majesté des oiseaux et leur passivité."
        ],
        "expectedAnswer": "« indolents compagnons de voyage » : les oiseaux sont humanisés et présentés comme nonchalants.",
        "solution": "Les albatros sont qualifiés d'**« indolents compagnons de voyage »**. Le mot « compagnons » les humanise (amorce de **personnification**), tandis que « indolents » souligne leur nonchalance et leur liberté dans les airs. Ce portrait valorisant prépare le contraste avec leur maladresse une fois capturés sur le pont, contraste sur lequel repose tout le poème."
      }
    ]
  }
]
