[
  {
    "id": "ex-dissertation-001",
    "module": "methode-dissertation",
    "title": "Disserter sur la fable : méthode pas à pas",
    "difficulty": 2,
    "estimatedMinutes": 25,
    "preamble": "Vous allez vous entraîner à la méthode de la dissertation à partir de la fable **« Le Corbeau et le Renard »** de La Fontaine (*Fables*, livre I, fable 2, 1668). Lisez attentivement la fable, puis répondez aux trois questions dans l'ordre. Chaque question correspond à une étape-clé de la méthode : choisir un plan, formuler une problématique, puis rédiger un paragraphe argumentatif.",
    "extract": "Maître Corbeau, sur un arbre perché,\nTenait en son bec un fromage.\nMaître Renard, par l'odeur alléché,\nLui tint à peu près ce langage :\n« Hé ! bonjour, Monsieur du Corbeau.\nQue vous êtes joli ! que vous me semblez beau !\nSans mentir, si votre ramage\nSe rapporte à votre plumage,\nVous êtes le phénix des hôtes de ces bois. »\nÀ ces mots le Corbeau ne se peut plus de joie ;\nEt pour montrer sa belle voix,\nIl ouvre un large bec, laisse tomber sa proie.\nLe Renard s'en saisit, et dit : « Mon bon Monsieur,\nApprenez que tout flatteur\nVit aux dépens de celui qui l'écoute.\nCette leçon vaut bien un fromage, sans doute. »\nLe Corbeau, honteux et confus,\nJura, mais un peu tard, qu'on ne l'y prendrait plus.",
    "extractSource": "Jean de La Fontaine, *Fables*, livre I, fable 2, 1668",
    "questions": [
      {
        "id": "q1",
        "label": "Question 1 — Identifier le type de plan",
        "statement": "On vous soumet le sujet suivant : *« La fable de La Fontaine est-elle seulement un divertissement ? »*\n\nIdentifiez le type de plan le plus adapté à ce sujet et justifiez votre choix en une ou deux phrases. Appuyez-vous sur la formulation du sujet.",
        "hints": [
          "Observez la formulation du sujet : contient-elle un mot restrictif comme « seulement » ou « uniquement » ?",
          "Un sujet fermé (oui/non possible) appelle un plan dialectique ; un sujet ouvert (« comment », « en quoi ») appelle un plan analytique.",
          "Le mot « seulement » crée une tension entre divertissement pur et autre chose (morale, critique…). C'est une opposition implicite."
        ],
        "expectedAnswer": "Plan dialectique",
        "solution": "Le sujet *« La fable de La Fontaine est-elle seulement un divertissement ? »* appelle un **plan dialectique**.\n\nLe mot **« seulement »** est le signal-clé : il formule une thèse restrictive (la fable = divertissement uniquement) que le développement devra d'abord valider (I. Thèse), puis nuancer en montrant qu'elle instruit aussi (II. Antithèse), avant de dépasser l'opposition en affirmant que plaisir et enseignement sont indissociables chez La Fontaine (III. Synthèse).\n\nCe sujet ne convient pas au plan analytique, qui s'applique aux sujets ouverts (*« En quoi »*, *« Comment »*) invitant à décrire différents aspects sans les opposer."
      },
      {
        "id": "q2",
        "label": "Question 2 — Formuler la problématique",
        "statement": "Toujours à partir du sujet *« La fable de La Fontaine est-elle seulement un divertissement ? »*, formulez une **problématique** adaptée.\n\nVotre problématique doit : être une question, reformuler le sujet en révélant sa tension, ne pas avoir de réponse immédiatement évidente.",
        "hints": [
          "Identifiez la tension : la fable divertit (récit, animaux, images) ET instruit (morale, critique sociale). Le sujet met ces deux fonctions en opposition.",
          "Utilisez une formulation du type *« Dans quelle mesure... »* ou *« Si la fable... en quoi cependant... »*.",
          "Évitez de répéter le sujet mot pour mot. Votre problématique doit enrichir le sens : nommez explicitement les deux fonctions en tension (plaire / instruire)."
        ],
        "expectedAnswer": "Dans quelle mesure la fable, en divertissant son lecteur, remplit-elle une mission d'enseignement moral et de critique sociale qui dépasse le simple plaisir ?",
        "solution": "Plusieurs formulations sont acceptables. Voici un modèle de référence :\n\n**Problématique proposée :** *Dans quelle mesure la fable de La Fontaine, en divertissant son lecteur par le récit et la fantaisie animale, remplit-elle simultanément une mission d'enseignement moral et de critique sociale qui dépasse le simple plaisir ?*\n\n**Pourquoi cette problématique est réussie :**\n- Elle est formulée sous forme de **question** (indispensable).\n- Elle reformule le sujet en nommant les deux pôles de la tension : **divertissement** (plaisir, récit, animaux) vs **mission morale et sociale** (enseignement, critique).\n- Elle emploie *« dans quelle mesure »*, formulation qui ouvre sur un développement nuancé en plusieurs parties.\n- Elle ne répond pas immédiatement oui ou non : la réponse exige un raisonnement en deux ou trois étapes.\n\n**Ce qu'il faut éviter :**\n- *« La fable instruit-elle vraiment ? »* → réponse évidente (oui), pas de tension.\n- *« La fable de La Fontaine est-elle un divertissement ? »* → simple reformulation du sujet."
      },
      {
        "id": "q3",
        "label": "Question 3 — Rédiger un paragraphe argumentatif",
        "statement": "Rédigez un **paragraphe argumentatif** développant l'idée suivante, dans le cadre du plan dialectique identifié en question 1 (Thèse, Partie I) :\n\n*Idée directrice : La Fontaine divertit son lecteur grâce à la vivacité du récit et au jeu entre les personnages animaux.*\n\nVotre paragraphe doit suivre la structure A.E.A. : Argument → Exemple (tiré de la fable ci-dessus) → Analyse. Longueur : 8 à 12 lignes.",
        "hints": [
          "Commencez par formuler clairement l'idée directrice en une phrase affirmative.",
          "Pour l'exemple, citez un passage précis de la fable (vers mis entre guillemets) : la flatterie du renard, la chute du fromage… Indiquez la référence (La Fontaine, *Fables*, I, 2).",
          "Pour l'analyse, expliquez un procédé stylistique concret (apostrophe, gradation, rythme) et montrez en quoi il produit l'effet de divertissement. Reliez à l'idée directrice."
        ],
        "expectedAnswer": "Paragraphe A.E.A. montrant que le divertissement naît du récit vif, du dialogue théâtral et du renversement comique, avec citation et analyse d'un procédé.",
        "solution": "**Modèle de paragraphe argumentatif (Partie I — Thèse) :**\n\nLa fable de La Fontaine divertit avant tout par la vivacité de son récit et le jeu dramatique entre deux personnages aux caractères tranchés. En quelques vers, La Fontaine construit un véritable mini-théâtre : le Renard multiplie les formules flatteuses en une série de questions rhétoriques — *« Que vous êtes joli ! que vous me semblez beau ! »* (v. 6) — qui forment une **gradation** mélodieuse et légèrement excessive, créant immédiatement un effet comique pour le lecteur averti. La chute est rapide et visuelle : *« Il ouvre un large bec, laisse tomber sa proie »* (v. 12), vers dont le rythme haché mime la stupidité du geste. Ce renversement de situation — le flatteur vole le flatté — constitue un ressort de comédie classique qui procure un plaisir immédiat. Ainsi, la fable divertit pleinement par sa brièveté, son dialogue animé et son dénouement inattendu.\n\n**Points méthodologiques à retenir :**\n- L'**argument** est énoncé dès la première phrase : vivacité du récit et jeu dramatique.\n- L'**exemple** est une citation textuelle entre guillemets avec référence au vers.\n- L'**analyse** nomme le procédé (gradation, rythme haché) et explique son effet (comique, plaisir immédiat).\n- Pas de paraphrase : chaque phrase analyse, ne résume pas."
      }
    ],
    "tags": ["dissertation", "plan dialectique", "problématique", "paragraphe argumentatif", "La Fontaine", "fable", "domaine public"]
  }
]
