[
  {
    "id": "ex-roman-001",
    "module": "roman",
    "title": "Analyser le point de vue narratif dans Manon Lescaut",
    "difficulty": 2,
    "estimatedMinutes": 20,
    "preamble": "Exercice d'analyse **sans extrait** : on travaille sur la **structure narrative** du roman telle qu'elle est présentée dans les fiches. *Manon Lescaut* est un **récit enchâssé** : Renoncour, « l'homme de qualité », rapporte dans un avant-propos sa rencontre avec le chevalier des Grieux ; à l'intérieur de ce cadre, **des Grieux raconte lui-même son histoire**, de façon **rétrospective** et **à la première personne**. Le lecteur ne connaît donc Manon qu'à travers le regard de l'homme qui l'aime. Répondez en mobilisant un vocabulaire d'analyse précis (narrateur, point de vue, récit-cadre, rétrospection).",
    "questions": [
      {
        "id": "q1",
        "label": "Identifier la structure",
        "statement": "Nommez précisément la structure narrative de *Manon Lescaut* et distinguez le narrateur du récit-cadre de celui du récit principal.",
        "hints": [
          "Pensez à l'image d'un récit « emboîté » dans un autre.",
          "Deux instances racontent : l'une présente l'autre."
        ],
        "expectedAnswer": "Récit enchâssé : Renoncour (récit-cadre) rapporte le récit que des Grieux fait lui-même de son aventure (récit principal, 1re personne, rétrospectif).",
        "solution": "Il s'agit d'un **récit enchâssé** (ou récit dans le récit). Le **récit-cadre** est tenu par **Renoncour**, l'homme de qualité, qui raconte avoir rencontré le chevalier et recueilli sa confidence. Le **récit principal**, qui occupe l'essentiel du roman, est celui que **des Grieux** fait de sa propre histoire : il est mené **à la première personne** et de manière **rétrospective**, le héros racontant après coup des événements déjà vécus."
      },
      {
        "id": "q2",
        "label": "Analyser l'effet sur le portrait de Manon",
        "statement": "Quelle conséquence ce point de vue a-t-il sur la connaissance que le lecteur a de Manon ? En quoi cela rend-il le personnage ambigu ?",
        "hints": [
          "Par quels yeux voit-on Manon ? A-t-on accès à ses pensées ?",
          "Un regard amoureux est-il un regard neutre et objectif ?"
        ],
        "expectedAnswer": "Manon n'est vue qu'à travers le regard amoureux et partial de des Grieux ; on n'accède pas directement à son intériorité, d'où son ambiguïté.",
        "solution": "Le lecteur ne connaît Manon **qu'à travers le regard de des Grieux**, qui est à la fois **amoureux** et **partial**. On n'accède jamais directement aux pensées de Manon : son intériorité reste **opaque**. Cette focalisation unique explique l'**ambiguïté** du personnage : tour à tour tendre et intéressée, sincère et calculatrice, Manon échappe à tout jugement assuré, ce qui nourrit la **fascination** romanesque qu'elle exerce."
      },
      {
        "id": "q3",
        "label": "Relier à la visée du récit",
        "statement": "En quoi le fait que des Grieux soit à la fois personnage et narrateur peut-il orienter le jugement du lecteur ? Reliez votre réponse au parcours « Personnages en marge, plaisirs du romanesque ».",
        "hints": [
          "Celui qui raconte sa propre faute cherche-t-il seulement à informer ?",
          "Pensez à l'émotion suscitée et à la tension entre morale et compassion."
        ],
        "expectedAnswer": "Narrateur de sa propre histoire, des Grieux cherche à émouvoir et à se justifier : il oriente la sympathie du lecteur, ce qui produit le plaisir romanesque et brouille le jugement moral.",
        "solution": "Comme des Grieux **raconte lui-même** son histoire, son récit n'est pas neutre : il cherche à **émouvoir** son auditeur (Renoncour) et, indirectement, à **se justifier** de ses fautes. Le lecteur est ainsi conduit à **compatir** avec des personnages pourtant condamnables. C'est là un ressort des **« plaisirs du romanesque »** : l'**émotion** et l'**ambiguïté morale** l'emportent souvent sur la condamnation, en tension avec la visée morale affichée par Prévost dans son *Avis de l'auteur*."
      }
    ],
    "tags": ["narratologie", "point-de-vue", "manon", "recit-enchasse", "parcours"],
    "order": 1
  }
]
