[
  {
    "id": "ex-poesie-001",
    "module": "poesie",
    "title": "Repérage de procédés dans « Sensation »",
    "difficulty": 1,
    "estimatedMinutes": 15,
    "preamble": "« Sensation » est un court poème de deux quatrains en alexandrins, daté de mars 1870. Le poète y projette une promenade au grand air où la sensation physique devient source de bonheur et de communion avec la nature. Lisez attentivement le texte, puis répondez aux questions de repérage.",
    "extract": "Par les soirs bleus d'été, j'irai dans les sentiers,\nPicoté par les blés, fouler l'herbe menue :\nRêveur, j'en sentirai la fraîcheur à mes pieds.\nJe laisserai le vent baigner ma tête nue.\n\nJe ne parlerai pas, je ne penserai rien :\nMais l'amour infini me montera dans l'âme,\nEt j'irai loin, bien loin, comme un bohémien,\nPar la Nature, — heureux comme avec une femme.",
    "extractSource": "Arthur Rimbaud, « Sensation », Cahiers de Douai, 1870",
    "questions": [
      {
        "id": "q1",
        "label": "Le temps des verbes",
        "statement": "Relevez le temps employé pour les principaux verbes (« j'irai », « je sentirai », « je laisserai »…). Quel est l'effet de ce temps sur le sens du poème ?",
        "hints": [
          "Observez la terminaison des verbes : -ai, -era…",
          "Ce temps n'exprime pas une action passée ni présente, mais à venir.",
          "La promenade est rêvée, projetée : elle n'a pas encore eu lieu."
        ],
        "expectedAnswer": "Le futur simple (« j'irai », « je sentirai », « je laisserai », « montera »).",
        "solution": "Les verbes sont au **futur simple** : « j'irai », « j'en sentirai », « je laisserai », « je ne parlerai pas », « me montera », « j'irai loin ». Ce futur projette une promenade **rêvée**, encore à venir : le bonheur naît de l'**anticipation** de la sensation. Le poème ne décrit pas une expérience accomplie mais un **désir d'évasion**, ce qui le rattache à l'élan d'émancipation du recueil."
      },
      {
        "id": "q2",
        "label": "Les sensations",
        "statement": "Relevez deux notations sensorielles précises et indiquez à quel sens chacune fait appel. En quoi le titre « Sensation » est-il justifié ?",
        "hints": [
          "Cherchez ce qui touche la peau, ce qui se voit, ce qui se ressent physiquement.",
          "« fraîcheur à mes pieds », « le vent baigner ma tête nue », « Picoté par les blés » : quel sens est sollicité à chaque fois ?"
        ],
        "expectedAnswer": "Le toucher (la fraîcheur, le vent, le picotement des blés) et la vue (« les soirs bleus d'été »).",
        "solution": "Le poème privilégie le **toucher** : « Picoté par les blés », « la fraîcheur à mes pieds », « le vent baigner ma tête nue ». La **vue** apparaît aussi avec « les soirs bleus d'été » (notation de couleur). Le titre **« Sensation »** est justifié par cette mise au premier plan du **corps** et du **sensible** : le poète choisit de **sentir** plutôt que de penser, comme le confirme le vers « Je ne parlerai pas, je ne penserai rien »."
      },
      {
        "id": "q3",
        "label": "La nature et la liberté",
        "statement": "Comment la nature est-elle présentée dans le poème ? Appuyez-vous sur la comparaison du dernier vers pour montrer le lien entre nature, bonheur et liberté.",
        "hints": [
          "Observez la majuscule à « Nature » : quel statut lui donne-t-elle ?",
          "Le dernier vers contient une comparaison : « heureux comme avec une femme ».",
          "Le « bohémien » est une figure d'errance et de liberté."
        ],
        "expectedAnswer": "La Nature (avec majuscule) est presque personnifiée et associée au bonheur ; la comparaison « heureux comme avec une femme » assimile la communion avec elle à un bonheur amoureux.",
        "solution": "La **majuscule** à « Nature » l'élève au rang d'entité quasi vivante, **complice** du poète : marcher « Par la Nature » revient à se fondre en elle. La **comparaison** finale, « heureux comme avec une femme », assimile cette communion à un **bonheur amoureux** : la nature comble le poète comme un être aimé. L'image du **« bohémien »** (errance, refus des attaches) lie ce bonheur à la **liberté** : se libérer du monde social et marcher au grand air suffit au bonheur. C'est une **émancipation par le bonheur simple**, au cœur du parcours."
      }
    ],
    "tags": ["Sensation", "repérage", "sensations", "futur", "nature"],
    "order": 1
  },
  {
    "id": "ex-poesie-002",
    "module": "poesie",
    "title": "Repérage de procédés dans « Le Dormeur du val »",
    "difficulty": 2,
    "estimatedMinutes": 20,
    "preamble": "« Le Dormeur du val » est un sonnet en alexandrins (deux quatrains et deux tercets), composé en 1870 sur fond de guerre franco-prussienne. Le poème décrit un jeune soldat étendu dans un décor naturel lumineux : il semble dormir, jusqu'à la révélation finale. Repérez les procédés qui préparent et accentuent cette chute.",
    "extract": "C'est un trou de verdure où chante une rivière,\nAccrochant follement aux herbes des haillons\nD'argent ; où le soleil, de la montagne fière,\nLuit : c'est un petit val qui mousse de rayons.\n\nUn soldat jeune, bouche ouverte, tête nue,\nEt la nuque baignant dans le frais cresson bleu,\nDort ; il est étendu dans l'herbe, sous la nue,\nPâle dans son lit vert où la lumière pleut.\n\nLes pieds dans les glaïeuls, il dort. Souriant comme\nSourirait un enfant malade, il fait un somme :\nNature, berce-le chaudement : il a froid.\n\nLes parfums ne font pas frissonner sa narine ;\nIl dort dans le soleil, la main sur sa poitrine,\nTranquille. Il a deux trous rouges au côté droit.",
    "extractSource": "Arthur Rimbaud, « Le Dormeur du val », Cahiers de Douai, 1870",
    "questions": [
      {
        "id": "q1",
        "label": "La nature personnifiée",
        "statement": "Relevez deux éléments montrant que la nature est personnifiée ou rendue vivante dans les quatrains. Quel effet cette animation produit-elle au début du poème ?",
        "hints": [
          "Une rivière qui « chante », une montagne « fière » : que prêtent ces verbes et adjectifs aux éléments naturels ?",
          "Le verbe « berce » (premier tercet) confirme cette animation maternelle."
        ],
        "expectedAnswer": "« où chante une rivière » et « la montagne fière » (et plus loin « Nature, berce-le ») : la nature est personnifiée, présentée comme vivante et accueillante.",
        "solution": "La nature est **personnifiée** : la rivière « chante », la « montagne fière » est dotée d'un sentiment humain, et plus loin la « Nature » est invitée à « berce[r] » le soldat. Cette animation crée un décor **vivant, riant et maternel**, qui suggère la douceur et le repos. Elle **endort la vigilance du lecteur** : on croit assister à un paisible sommeil, ce qui rendra la révélation finale d'autant plus brutale."
      },
      {
        "id": "q2",
        "label": "Le champ lexical du sommeil",
        "statement": "Relevez le champ lexical du sommeil et du repos. Pourquoi Rimbaud insiste-t-il autant sur cette idée tout au long du poème ?",
        "hints": [
          "Cherchez les verbes et expressions répétés : « Dort », « il fait un somme »…",
          "Le verbe « dort » revient plusieurs fois.",
          "Cette insistance entretient une illusion que la fin va briser."
        ],
        "expectedAnswer": "« Dort », « il dort » (répété), « il fait un somme », « Tranquille » : un champ lexical du sommeil et du repos parcourt tout le poème.",
        "solution": "Le champ lexical du **sommeil et du repos** domine : « Dort », « il dort » (répété au vers 9 et au vers 13), « il fait un somme », « Tranquille ». Cette **insistance** entretient l'**illusion** d'un sommeil paisible et retarde la vérité. Le lecteur est invité à croire que le soldat se repose, alors que le poète prépare en réalité une **chute tragique** : l'immobilité n'est pas le repos, mais la mort."
      },
      {
        "id": "q3",
        "label": "La chute et l'antithèse",
        "statement": "Analysez le dernier vers. En quoi constitue-t-il une « chute » ? Montrez l'antithèse qui structure tout le sonnet entre la nature et le soldat.",
        "hints": [
          "Le dernier vers contient « deux trous rouges au côté droit » : que révèle cette image ?",
          "Opposez la vie et la lumière de la nature à l'état réel du soldat.",
          "La rupture est aussi rythmique : « Tranquille. » isolé en début de vers."
        ],
        "expectedAnswer": "« Il a deux trous rouges au côté droit » révèle que le soldat est mort, tué par balle : c'est une chute brutale. L'antithèse oppose la vie de la nature (lumière, chant, verdure) à la mort du jeune homme.",
        "solution": "Le dernier vers, « Il a deux trous rouges au côté droit », opère une **chute** : l'image crue des blessures révèle d'un coup que le soldat est **mort**, tué par balle. La périphrase pudique « deux trous rouges » contraste avec l'horreur qu'elle désigne. Tout le sonnet repose sur une **antithèse** entre la **vie de la nature** (lumière, « rayons », chant de la rivière, verdure) et la **mort du jeune homme**. Le mot « Tranquille. », isolé en tête de vers par un **rejet**, marque une rupture de rythme qui prépare la révélation. Ainsi le tableau idyllique se renverse en **dénonciation de la guerre** : Rimbaud condamne la mort absurde des jeunes soldats de 1870."
      }
    ],
    "tags": ["Le Dormeur du val", "personnification", "antithèse", "chute", "guerre"],
    "order": 2
  }
]
