[
  {
    "id": "ex-theatre-001",
    "module": "theatre",
    "title": "Analyser la mécanique de la dispute (sans citation)",
    "difficulty": 2,
    "estimatedMinutes": 20,
    "preamble": "**Œuvre support : Nathalie Sarraute, *Pour un oui ou pour un non* (1981), parcours « Théâtre et dispute ».**\n\n*L'œuvre étant sous droits, aucune réplique n'est reproduite : on raisonne à partir d'une situation **décrite et paraphrasée**.*\n\n**Situation décrite (paraphrase) :** Dans cette pièce en un acte, deux amis de longue date, désignés H1 et H2, se retrouvent. H1 s'inquiète du refroidissement de leur amitié et cherche à en comprendre la cause. H2 finit par révéler qu'une parole anodine, prononcée jadis par H1 — une félicitation à propos d'une réussite — l'a profondément blessé, non par son sens, mais par le **ton** sur lequel elle a été dite, ressenti comme condescendant. À mesure que le dialogue progresse, les reproches et les justifications s'enchaînent, la tension monte, et les voisins sont même appelés comme « témoins » pour arbitrer la querelle. Aucune action extérieure : tout se joue dans l'échange des paroles.\n\nÀ partir de cette description, répondez aux questions suivantes. **Ne citez jamais de réplique : décrivez et paraphrasez.**",
    "questions": [
      {
        "id": "q1",
        "label": "Repérage — l'objet du conflit",
        "statement": "Quel est l'élément déclencheur de la dispute, et pourquoi peut-on parler d'une querelle « pour un rien » ?",
        "hints": [
          "Cherchez ce que H2 reproche concrètement à H1.",
          "Distinguez le **sens** des mots et le **ton** sur lequel ils ont été dits.",
          "Pensez à la disproportion entre la cause (minuscule) et l'effet (une rupture)."
        ],
        "expectedAnswer": "Le déclencheur est une félicitation anodine perçue comme condescendante à cause de son ton ; la cause est infime, d'où l'idée d'une brouille « pour un rien ».",
        "solution": "Le déclencheur est une **parole anodine** : une félicitation que H1 avait jadis adressée à H2. Ce n'est pas le **sens** de cette parole qui blesse, mais le **ton** sur lequel elle aurait été prononcée, ressenti par H2 comme **condescendant**, légèrement supérieur. La cause du conflit est donc un **détail infime**, presque imperceptible. C'est précisément cette **disproportion** entre l'insignifiance de la cause et l'ampleur de la rupture qui justifie le titre : une brouille **« pour un oui ou pour un non »**, c'est-à-dire **pour un rien**. Le véritable sujet n'est pas l'événement, mais le **poids du non-dit et de l'implicite**."
      },
      {
        "id": "q2",
        "label": "Analyse — la dramaturgie de la parole",
        "statement": "Montrez que, dans cette situation, le conflit tient lieu d'action. Quels procédés dramatiques en assurent la progression ?",
        "hints": [
          "Notez qu'il n'y a presque aucune action extérieure.",
          "Observez la progression : aveu, reproches, justifications, montée de la tension.",
          "Pensez au rythme du dialogue (reprises, hésitations, silences) et au rôle des « témoins »."
        ],
        "expectedAnswer": "L'action est la dispute elle-même : elle progresse par paliers (aveu, reproches, escalade), portée par le rythme du dialogue et l'appel aux témoins, sans aucune péripétie extérieure.",
        "solution": "La pièce illustre une **dramaturgie de la parole** : il ne se passe presque **rien sur le plan de l'action**, et pourtant la tension dramatique est constante. C'est le **dialogue lui-même** qui constitue l'action. La dispute suit une **progression** nette : un malaise d'abord feutré, puis l'**aveu** du grief, l'enchaînement des **reproches** et des **justifications**, enfin une **montée de la tension** par paliers. Le **rythme** du dialogue (reprises, hésitations, phrases inachevées, **silences** chargés) entretient cette tension. L'appel aux **voisins-témoins** transforme la querelle en **spectacle** que l'on joue devant autrui, sans pour autant la résoudre. Le conflit verbal **remplace** ainsi l'intrigue traditionnelle."
      },
      {
        "id": "q3",
        "label": "Interprétation — tropismes et sous-conversation",
        "statement": "En quoi cette situation illustre-t-elle les notions de **tropismes** et de **sous-conversation** propres à Sarraute ?",
        "hints": [
          "Rappelez la définition de chaque notion.",
          "Reliez la blessure de H2 à un mouvement intérieur infime.",
          "Montrez que la conversation de surface cache une violence souterraine."
        ],
        "expectedAnswer": "La blessure de H2 relève d'un tropisme (mouvement intérieur infime) ; la conversation polie de surface cache une sous-conversation faite de tensions et de reproches non dits.",
        "solution": "La situation est une mise en scène des **tropismes** : la blessure de H2 naît d'un **mouvement intérieur infime**, presque **pré-langagier** — une vexation fugitive provoquée par un simple ton. Elle relève donc moins du raisonnement que d'une réaction instinctive et secrète. Quant à la **sous-conversation**, elle apparaît dans l'écart entre la **parole de surface** (un échange d'apparence anodine, voire polie, entre deux amis) et la **charge cachée** qu'elle transporte : reproches, attentes déçues, agressivité feutrée. Le théâtre devient ici l'instrument qui rend **audible cette vie souterraine** : sous la banalité des mots affleure une **violence** réelle. La pièce prolonge ainsi, sur scène, le projet d'écriture du **Nouveau Roman**."
      }
    ],
    "tags": ["theatre", "dispute", "tropismes", "sous-conversation", "sarraute"],
    "order": 1
  }
]
