[
  {
    "id": "ex-registres-genres-001",
    "module": "registres-genres",
    "title": "Identifier le registre dans un extrait de Racine",
    "difficulty": 2,
    "estimatedMinutes": 20,
    "preamble": "Cet extrait est tiré de *Phèdre* de Jean Racine (1677), tragédie en cinq actes et en vers. Dans cette scène, Phèdre, reine d'Athènes, avoue à sa confidente Œnone l'amour coupable et irrésistible qu'elle éprouve pour Hippolyte, son beau-fils. Lisez attentivement l'extrait, puis répondez aux questions.",
    "extract": "Ce n'est plus une ardeur dans mes veines cachée :\n C'est Vénus tout entière à sa proie attachée.\n J'ai conçu pour mon crime une juste terreur ;\n J'ai pris la vie en haine, et ma flamme en horreur.\n Je voulais en mourant prendre soin de ma gloire,\n Et dérober au jour une flamme si noire :\n Je n'ai pu soutenir tes larmes, tes combats ;\n Je t'ai tout avoué ; je ne m'en repens pas,\n Pourvu que de ma mort respectant les approches,\n Tu ne m'affliges plus par d'injustes reproches.",
    "extractSource": "Jean Racine, *Phèdre*, acte II, scène 5, 1677",
    "questions": [
      {
        "id": "q1",
        "label": "Question 1 — Identification du registre",
        "statement": "Quel est le registre dominant de cet extrait ? Justifiez votre réponse en une phrase.",
        "hints": [
          "Observez le champ lexical dominant : quels mots appartiennent à la même famille sémantique ?",
          "Phèdre peut-elle se soustraire à son amour pour Hippolyte ? Quelle figure mythologique est convoquée ?",
          "Le personnage est-il libre ou condamné ? Y a-t-il une issue possible ?"
        ],
        "expectedAnswer": "Le registre dominant est le registre tragique.",
        "solution": "Le registre dominant est le **registre tragique**.\n\nPhèdre est présentée comme soumise à un **destin inéluctable** : la déesse Vénus l'a condamnée à un amour coupable qu'elle ne peut combattre (« C'est Vénus tout entière à sa proie attachée »). Le lexique de la fatalité et de la mort abonde : *crime*, *terreur*, *haine*, *horreur*, *mourant*, *mort*. Phèdre n'a aucune échappatoire — elle envisage la mort comme seule issue — ce qui constitue la **chute irréversible** caractéristique du tragique."
      },
      {
        "id": "q2",
        "label": "Question 2 — Relevé d'indices textuels",
        "statement": "Relevez trois indices textuels précis qui confirment le registre identifié à la question 1. Pour chaque indice, nommez le procédé et expliquez en une phrase son effet.",
        "hints": [
          "Cherchez des mots appartenant au champ lexical de la mort et de la condamnation.",
          "Identifiez la figure de style du vers 2 (« C'est Vénus tout entière à sa proie attachée ») : que dit-elle sur la liberté de Phèdre ?",
          "Regardez également la construction des vers 3-4 : les oppositions entre termes renforcent-elles le sentiment d'impossibilité ?"
        ],
        "expectedAnswer": "Trois indices : la métaphore de la proie, le lexique de la mort (mourir, mort), les antithèses vie/haine et flamme/horreur.",
        "solution": "Trois indices textuels du registre tragique :\n\n1. **« C'est Vénus tout entière à sa proie attachée »** (v. 2) — **métaphore** de la chasse : Phèdre est la *proie* d'une déesse, c'est-à-dire une victime sans défense. L'effet est de souligner l'absence totale de liberté du personnage, soumis à une force divine supérieure : la chute est **inéluctable**.\n\n2. **« J'ai pris la vie en haine »** et **« Je voulais en mourant prendre soin de ma gloire »** (v. 4-5) — **lexique de la mort et de la haine de soi** : Phèdre envisage sa propre mort comme délivrance. L'effet est d'intensifier le sentiment de condamnation : le personnage ne peut vivre avec sa faute ni s'en défaire.\n\n3. **« J'ai conçu pour mon crime une juste terreur ; / J'ai pris la vie en haine, et ma flamme en horreur »** (v. 3-4) — **antithèse** entre ce qu'elle ressent (*flamme* = amour) et ce qu'elle en pense (*horreur*) ; **anaphore** de « J'ai » qui martèle la conscience lucide de sa culpabilité. L'effet est de figurer le déchirement intérieur tragique : Phèdre se juge elle-même, mais ne peut s'arrêter."
      },
      {
        "id": "q3",
        "label": "Question 3 — Effet produit sur le lecteur",
        "statement": "Comment ce registre produit-il son effet sur le lecteur ou le spectateur ? Rédigez un paragraphe de 5 à 6 lignes en vous appuyant sur l'extrait.",
        "hints": [
          "Aristote définit la tragédie comme suscitant *terreur* et *pitié* (catharsis). Laquelle de ces deux émotions domine ici ?",
          "Phèdre est-elle présentée comme une coupable ou comme une victime ? Les deux à la fois ?",
          "Pensez à la façon dont la lucidité de Phèdre (elle sait que son amour est criminel) intensifie l'émotion."
        ],
        "expectedAnswer": "Le registre tragique suscite à la fois terreur et pitié : terreur devant la puissance des dieux, pitié pour une héroïne lucide et impuissante.",
        "solution": "Le registre tragique produit son effet en suscitant simultanément la **terreur** et la **pitié** — les deux émotions que la tragédie aristotélicienne cherche à provoquer pour opérer la *catharsis*.\n\nLa **pitié** naît de la figure de Phèdre, présentée comme une **victime** autant que coupable : elle n'a pas choisi cet amour (« C'est Vénus tout entière à sa proie attachée »), et la lucidité avec laquelle elle contemple sa propre déchéance (« J'ai pris la vie en haine, et ma flamme en horreur ») rend sa souffrance plus poignante encore. Le lecteur compatit à une conscience malheureuse qui se juge sans pouvoir se corriger.\n\nLa **terreur** naît de la représentation d'une puissance divine invincible : Vénus a condamné Phèdre, et aucun effort humain ne peut s'y opposer. La mort apparaît comme la seule issue, ce qui ferme toute perspective d'espoir. C'est ce sentiment d'une **fatalité irréversible** qui caractérise par excellence le registre tragique."
      }
    ],
    "tags": ["registre tragique", "Racine", "Phèdre", "identification", "analyse"],
    "order": 1
  }
]
