[
  {
    "id": "ex-litt-idees-001",
    "module": "litterature-idees",
    "title": "Le regard étranger : repérer les procédés de la critique indirecte",
    "difficulty": 2,
    "estimatedMinutes": 20,
    "preamble": "Aucun extrait verbatim n'est cité ici : on travaille à partir d'une **situation décrite** du roman, pour s'exercer à nommer les procédés du *regard étranger*.\n\n**Situation (paraphrasée, non citée) :** dans plusieurs lettres adressées à Aza, Zilia, fraîchement arrivée en France, rapporte sa découverte de la vie mondaine. Elle décrit avec étonnement des usages dont elle ne comprend pas la logique : la frénésie des visites et des conversations brillantes mais vides, l'importance accordée aux apparences et au paraître, le décalage entre la politesse affichée et la réalité des sentiments. Faute d'en connaître les codes, elle les présente comme des comportements étranges, presque incompréhensibles.\n\nOn appelle ce dispositif le **regard étranger** (ou **décentrement**) : une observatrice venue d'ailleurs décrit naïvement une société qui n'est pas la sienne, ce qui en révèle l'arbitraire.",
    "questions": [
      {
        "id": "q1",
        "label": "Identifier le procédé",
        "statement": "Comment nomme-t-on le procédé par lequel Graffigny fait décrire la société française par une observatrice inca qui n'en partage pas les codes ? À quelle œuvre antérieure rattache-t-on ce dispositif ?",
        "hints": [
          "Pense au point de vue : qui regarde, et avec quels repères ?",
          "Le terme commence par « regard… » ou « dé… ».",
          "L'œuvre modèle est de Montesquieu et date de 1721."
        ],
        "expectedAnswer": "Le regard étranger (ou décentrement) ; modèle : les Lettres persanes de Montesquieu (1721).",
        "solution": "Le procédé est le **regard étranger** (ou **décentrement**) : une observatrice venue d'ailleurs (Zilia, princesse inca) décrit une société qu'elle ne connaît pas, ce qui en fait ressortir l'**arbitraire** et l'**étrangeté**. Ce dispositif est l'héritier direct des ***Lettres persanes*** de **Montesquieu (1721)**, où Usbek et Rica observent la France en étrangers. Graffigny reprend ce procédé en le **féminisant** : c'est une femme, et de surcroît une étrangère doublement marginalisée, qui porte le regard critique."
      },
      {
        "id": "q2",
        "label": "Expliquer l'effet critique",
        "statement": "Pourquoi le fait que Zilia ne comprenne pas les usages français produit-il un effet critique ? En quoi parle-t-on d'argumentation indirecte ?",
        "hints": [
          "Que se passe-t-il quand on décrit comme « étrange » une coutume que tout le monde trouve « naturelle » ?",
          "Qui tire la conclusion : l'autrice, ou le lecteur ?"
        ],
        "expectedAnswer": "Le décalage entre le regard neuf et la coutume « naturelle » révèle son arbitraire ; l'autrice ne juge pas frontalement, c'est le lecteur qui conclut : argumentation indirecte.",
        "solution": "En décrivant naïvement, comme des phénomènes **étranges**, des coutumes que les Français trouvent **naturelles** (le goût du paraître, la frivolité mondaine, le décalage entre politesse et sincérité), Zilia crée un **décalage** qui en dénonce l'**arbitraire** : ce qui paraissait évident devient discutable. La critique est **indirecte** car Graffigny n'attaque pas frontalement : elle place le lecteur dans la position de tirer lui-même les conclusions du **contraste** entre le regard neuf de l'étrangère et la réalité observée. C'est une forme caractéristique de l'**argumentation indirecte** de la littérature d'idées du XVIIIe siècle (à côté du conte philosophique ou de la fable)."
      },
      {
        "id": "q3",
        "label": "Mobiliser des procédés d'écriture",
        "statement": "Citez deux procédés d'écriture (registre, figure ou posture énonciative) qui servent ce regard critique, et expliquez brièvement leur rôle.",
        "hints": [
          "Pense au registre satirique et au ton.",
          "L'« étonnement » de la narratrice est-il toujours sincère ? Cherche du côté de l'ironie et du contraste."
        ],
        "expectedAnswer": "Par exemple : l'étonnement feint et l'ironie (registre satirique) ; le contraste / l'antithèse entre valeurs incas et usages français.",
        "solution": "Plusieurs procédés soutiennent la critique :\n\n- **L'étonnement (feint) de la narratrice** : posture énonciative qui transforme l'ordinaire en énigme et oblige à s'interroger sur ce qui semblait aller de soi.\n- **L'ironie** et le **registre satirique** : sous couvert de naïveté, le texte raille la vanité et la frivolité mondaines.\n- **Le contraste / l'antithèse** : l'opposition entre les valeurs incas (sincérité, simplicité, sobriété) et les usages français (apparence, dépense, conversation vide) sert de mesure critique.\n- **La comparaison des cultures et des religions** : en rapportant les pratiques françaises au culte du Soleil de son pays, Zilia invite au **relativisme** et à la **tolérance**.\n\nNommer deux de ces procédés et expliquer leur rôle suffit ; l'essentiel est de relier le **procédé** à l'**effet critique** produit."
      }
    ],
    "tags": ["regard-etranger", "argumentation-indirecte", "critique-sociale", "methode"],
    "order": 1
  }
]
