[
  {
    "id": "ex-commentaire-001",
    "module": "methode-commentaire",
    "title": "Construire un paragraphe d'analyse",
    "difficulty": 2,
    "estimatedMinutes": 15,
    "order": 10,
    "tags": ["paragraphe", "méthode"],
    "preamble": "On souhaite analyser le vers suivant, extrait d'un poème où le poète évoque la fuite du temps. L'objectif est de rédiger **un** paragraphe d'analyse complet (idée → citation → procédé → interprétation).",
    "extract": "Ô temps, suspends ton vol ! et vous, heures propices,\nSuspendez votre cours !",
    "extractSource": "Alphonse de Lamartine, « Le Lac », Méditations poétiques, 1820",
    "questions": [
      {
        "id": "q1",
        "label": "1.",
        "statement": "Quel procédé d'énonciation domine ces vers ? Nomme-le précisément.",
        "hints": [
          "Le poète s'adresse directement à quelque chose qui ne peut pas répondre.",
          "« Ô temps… suspends » : il parle au temps comme à une personne."
        ],
        "expectedAnswer": "Une apostrophe (« Ô temps ») doublée d'une personnification du temps, à l'impératif.",
        "solution": "Le poète interpelle directement le temps : **« Ô temps, suspends ton vol ! »**. On relève une **apostrophe** (marquée par l'interjection « Ô ») adressée à une entité abstraite, ainsi qu'une **personnification** : le temps est traité comme un être capable d'agir, à qui l'on donne un ordre à l'**impératif** (« suspends », « suspendez »)."
      },
      {
        "id": "q2",
        "label": "2.",
        "statement": "Rédige un paragraphe d'analyse complet montrant que ces vers expriment le désir d'arrêter le temps. Respecte l'ordre : idée directrice, citation, procédé, interprétation.",
        "hints": [
          "Commence par une phrase qui annonce l'idée (le désir d'immobiliser le temps).",
          "Insère la citation, nomme l'apostrophe / la personnification / l'impératif, puis explique l'effet.",
          "Termine en reliant l'effet à l'émotion du poète (l'angoisse de la fuite du temps)."
        ],
        "expectedAnswer": "Un paragraphe organisé : idée → citation → procédé(s) → interprétation.",
        "solution": "**Idée directrice.** Ces vers traduisent le désir vain du poète d'**immobiliser le temps**.\n\n**Citation et procédés.** Il s'adresse au temps lui-même : « Ô temps, suspends ton vol ! ». L'**apostrophe** (« Ô temps ») et la **personnification** transforment une notion abstraite en interlocuteur, tandis que l'**impératif** (« suspends », « suspendez ») exprime une injonction pressante.\n\n**Interprétation.** En commandant au temps de s'arrêter, le poète révèle son **angoisse** face à la fuite des heures heureuses : l'ordre est nécessairement voué à l'échec, ce qui rend la supplication d'autant plus pathétique. Le rythme exclamatif renforce l'**émotion** et donne au vœu une intensité presque désespérée."
      }
    ]
  }
]
